Museum, Venue, Address
Guggenheim Museum di New York, New York United States, 1071 Fifth Avenue New York NY 10128
Peggy Guggenheim Collection di Venezia, Venice Italy, Palazzo Venier dei Leoni Dorsoduro 701 Venezia Italia
Guggenheim Museum di Bilbao, Bilbao Spain, venida Abandoibarra 2 Bilbao Spain
Deutsche Guggenheim di Berlino, Berlin Germany, Unter den Linden 13/15 10117 Berlin
Guggenheim Hermitage Museum di Las Vegas, Las Vegas United States,  3655 South Las Vegas Boulevard Nevada United States
Guggenheim Museum di Guadalajara, Guadalajara Mexico, Guadalajara Mexico
Guggenheim Museum Abu Dhabi di Abu Dhabi, Emirati Arabi Uniti, Saadiyat Island Abu Dhabi
Guggenheim Bucarest di Bucarest, Bucarest Romania, Bucarest Romania
Vilnius Guggenheim Hermitage Museum di Vilnius, Vilnius Lituania , Vilnius Lituania